<?xml version="1.0" encoding="UTF-8"?>
<!DOCTYPE scenario SYSTEM "TuTalkScenario.dtd">
<scenario default-language="en" scenario-name="scenario-academy_info_300">
	<configuration>
		
		<!-- It *is* possible to hook up a LightSide classifier to TuTalk, 
		such that the predicted labels are treated as concepts. 
		but not today. -->
			
		<!-- 	
		<module kind="model" name="animals"
			classname="edu.cmu.cs.lti.tutalk.module.SidePredictor">
			<param key="path" value="models/animals.ser" />
		</module> 
		-->

	</configuration>

	<!-- I'm not entirely sure what these are used for. -->
	<transitions>
		<transition ack-type="agree" floor-status="neutral">
			<tphrase> yes </tphrase>
			<tphrase> okay </tphrase>
		</transition>
	
		<transition ack-type="none">
			<tphrase> moving on... </tphrase>
		</transition>
	</transitions>
	
	<!-- 'Concepts' define things that students might say,
	     AND things that the tutor might say back. 
	     Tutor concepts should take the form of phrase lists.
		 Student concepts can be phrase lists, 
		 regular expressions, or lists of annotations,
	     but only one of these at a time. -->
		
	<concepts>
		<!-- this is a special kind of concept for catching unexpected student responses -->
		<concept label="unanticipated-response">
			<phrase>anything else</phrase>
		</concept>
		
		
		<!-- tutor concepts. -->
		<concept label="introduction">
			<phrase>Let's do Academy Program Info for 300.
            </phrase>
		</concept>

		<concept label="conclusion1">
			<phrase>If you didn't answer this question, you're next up! Please choose another question to answer.</phrase>
		</concept>
		

		<concept label="question1">
			<phrase>Academy launched in this year. | (You have about 30 seconds to guess before I give you a hint. I'll tell you if you're right; otherwise, keep guessing!)
            </phrase>
		</concept>

		<concept label="unrecognized">
			<phrase>I don't know what that is.</phrase>
			<phrase>That doesn't make sense to me.</phrase>
		</concept>
		
		<concept label="correct">
			<phrase>Well done!</phrase>
			<phrase>Okeydoke.</phrase>
			<phrase>Sounds good...</phrase>
		</concept>
		
		<concept label="ok">
			<phrase>Ok</phrase>
		</concept>


		<concept label="response1_1">
			<phrase>2019 is correct!</phrase>
		</concept>

		<concept label="response1_2">
			<phrase>It sounds like you could use some help. Anyone can chime in!</phrase>
		</concept>
		
		<concept label="incorrect">
			<phrase>You don't have the correct answer yet. Here's a hint...</phrase>
		</concept>


		<concept label="fix_response1">
			<phrase>Let me help you out. Academy launched in *2019*.
			</phrase>
		</concept>

		<concept label="yes" type="annotation">
			<phrase>AFFIRMATIVE</phrase>
		</concept>
		
		<concept label="no" type="annotation">
			<phrase>NEGATIVE</phrase>
		</concept>


		<concept label="answer1_1" type="regex">
			<phrase>2019</phrase>
		</concept>

		


	</concepts>


	<script>
		<goal name="start" difficulty="1">
			
			<step>
				<!-- Every step begins with an initiating concept or literal phrase -->
				<initiation>question1</initiation>
				
				<!-- These are the "response" options. 
					If the concept between the tags matches the student statement,
				    the "say" concept/phrase will be delivered by the tutor.
				    "push" adds another goal to the dialogue's stack. 
					 Note that goals should NOT be recursively nested. -->
					
				<response say="response1_1">answer1_1</response>
				<response say="incorrect" push="elicitate1">unanticipated-response</response>
				
			</step>

			<step>
				<initiation>conclusion1</initiation>
			</step>


			
		</goal>

		<goal name="elicitate1" difficulty="0">

			<step>
				<initiation>WGU Academy was launched some time between 2015 and 2020.</initiation>
                <response say="response1_1">answer1_1</response>
				<response say="fix_response1">unanticipated-response</response>
			</step>
		</goal>


	</script>

</scenario>