<?xml version="1.0" encoding="UTF-8"?>
<!DOCTYPE scenario SYSTEM "TuTalkScenario.dtd">
<scenario default-language="en" scenario-name="Look_right">
	<configuration>
		</module> -->
	</configuration>

	<transitions>
	
		<transition ack-type="none">
			<tphrase>Look right</tphrase>
		</transition>
	</transitions>
	
	<concepts>
		<concept label="unanticipated-response">
			<phrase>Look right</phrase>
		</concept>
		<concept label="intro">
			<phrase>Look right</phrase>
		</concept>
		
		<concept label="yes" type="annotation">
			<phrase>AFFIRMATIVE</phrase>
		</concept>
		
		<concept label="no" type="annotation">
			<phrase>NEGATIVE</phrase>
		</concept>
		
		<concept label="look_right_1">
			<phrase>Look right</phrase>
		</concept>
		
		<concept label="look_right_2">
			<phrase>Look right</phrase>
		</concept>
		
	</concepts>

	<script>
		<goal name="start" difficulty="1">
			<step>
				<initiation>intro</initiation>
				<response say="look_right_1">yes</response>
				<response say="look_right_2">no</response>
				<response say="look_right_2">unanticipated-response</response>
			</step>
		</goal>
	</script>

</scenario>
