<?xml version="1.0" encoding="UTF-8"?>
<!DOCTYPE scenario SYSTEM "TuTalkScenario.dtd">
<scenario default-language="en" scenario-name="hug_example">
	<configuration>
<!-- 		<module kind="model" name="animals"
			classname="edu.cmu.cs.lti.tutalk.module.SidePredictor">
			<param key="path" value="models/animals.ser" />
		</module> -->
	</configuration>

	<transitions>
	
		<transition ack-type="none">
			<tphrase> moving on... </tphrase>
		</transition>
	</transitions>
	
	<concepts>
		<concept label="unanticipated-response">
			<phrase>anything else</phrase>
		</concept>
		<concept label="intro">
			<phrase>Is it clear?</phrase>
		</concept>
		
		<concept label="yes" type="annotation">
			<phrase>AFFIRMATIVE</phrase>
		</concept>
		
		<concept label="no" type="annotation">
			<phrase>NEGATIVE</phrase>
		</concept>
		
		<concept label="yes_response">
			<phrase>Ok</phrase>
		</concept>
		
		<concept label="no_response">
			<phrase>:-(</phrase>
		</concept>
		
	</concepts>

	<script>
		<goal name="start" difficulty="1">
			<step>
				<initiation>intro</initiation>
				<response say="yes_response">yes</response>
				<response say="no_response">no</response>
				<response say="no_response">unanticipated-response</response>
			</step>
		</goal>
	</script>

</scenario>
