<?xml version="1.0" encoding="UTF-8"?>
<!DOCTYPE scenario SYSTEM "TuTalkScenario.dtd">
<scenario default-language="en" scenario-name="recorder_api">
	<configuration>
		
		<!-- It *is* possible to hook up a LightSide classifier to TuTalk, 
		such that the predicted labels are treated as concepts. 
		but not today. -->

	</configuration>

	<!-- I'm not entirely sure what these are used for. -->
	<transitions>
		<transition ack-type="agree" floor-status="neutral">
			<tphrase> yes </tphrase>
			<tphrase> okay </tphrase>
		</transition>
	
		<transition ack-type="none">
			<tphrase> moving on... </tphrase>
		</transition>
	</transitions>
	
	<!-- 'Concepts' define things that students might say,
	     AND things that the tutor might say back. 
	     Tutor concepts should take the form of phrase lists.
		 Student concepts can be phrase lists, 
		 regular expressions, or lists of annotations,
	     but only one of these at a time. -->
		
	<concepts>
		<!-- this is a special kind of concept for catching unexpected student responses -->
		<concept label="unanticipated-response">
			<phrase>anything else</phrase>
		</concept>
		
		
		<!-- tutor concepts. -->
		<concept label="introduction">
			<phrase>I can help you to decide the type of audio encoding to be used and example code snippet to do it.</phrase>
		</concept>
		
		<concept label="audio_encoding">
			<phrase>Do you know or decided on any audio encoding that can be used?</phrase>
		</concept>
		
		<!-- the tutor will choose randomly between multiple phrases for a concept. -->
		<concept label="facts">
			<phrase>You may probably want to use one of the following possible audio codecs
aac
aac_eld
amr_nb
amr_wb
default
he_aac
vorbis
			
			</phrase>
		</concept>
		
		<concept label="aac" type="regex">
			<phrase>aac-lc|low complexity</phrase>
		</concept>
		
		<concept label="aac_eld" type="regex">
			<phrase>aac_eld|aac-eld|enhanced low delay</phrase>
		</concept>
		
		<concept label="default" type="regex">
			<phrase>default</phrase>
		</concept>
	
			<concept label="amr_nb" type="regex">
			<phrase>amr_nb|narrowband</phrase>
		</concept>
		
				<concept label="amr_wb" type="regex">
			<phrase>amr_wb|amr wideband</phrase>
		</concept>
		
				<concept label="he_aac" type="regex">
			<phrase>he_aac|he-aac|high efficiency</phrase>
		</concept>
		
				<concept label="vorbis" type="regex">
			<phrase>vorbis|ogg</phrase>
		</concept>

		<concept label="unrecognized">
			<phrase>I don't know what that is.</phrase>
			<phrase>That doesn't make sense to me.</phrase>
		</concept>
		
		<concept label="correct">
			<phrase>Well done!</phrase>
			<phrase>Okeydoke.</phrase>
			<phrase>Sounds good...</phrase>
		</concept>
		
		<concept label="ok">
			<phrase>Ok</phrase>
		</concept>
		
		<concept label="aac_p" >
			<phrase>You can use AAC Low Complexity (AAC-LC) audio codec using following code snippet
			
			recorder_obj.setAudioEncoder(MediaRecorder.AudioEncoder.AAC);
			
			</phrase>
		</concept>
		
		<concept label="aac_eld_p" >
			<phrase>You can use Enhanced Low Delay AAC (AAC-ELD) audio codec using following code snippet
			
			recorder_obj.setAudioEncoder(MediaRecorder.AudioEncoder.AAC_ELD);
			
			</phrase>
		</concept>
		
		<concept label="default_p" >
			<phrase>You can use default audio codec using following code snippet
			
			recorder_obj.setAudioEncoder(MediaRecorder.AudioEncoder.DEFAULT);
			
			</phrase>
		</concept>
	
			<concept label="amr_nb_p" >
			<phrase>You can use AMR (Narrowband) audio codec using following code snippet
			
			recorder_obj.setAudioEncoder(MediaRecorder.AudioEncoder.AMR_NB);
			
			</phrase>
		</concept>
		
				<concept label="amr_wb_p" >
			<phrase>You can use AMR (Wideband) audio codec using following code snippet
			
			recorder_obj.setAudioEncoder(MediaRecorder.AudioEncoder.AMR_WB);
			
			</phrase>
		</concept>
		
				<concept label="he_aac_p" >
			<phrase>You can use High Efficiency AAC (HE-AAC) audio codec using following code snippet
			
			recorder_obj.setAudioEncoder(MediaRecorder.AudioEncoder.HE_AAC);
			
			</phrase>
		</concept>
		
				<concept label="vorbis_p" >
			<phrase>You can use Ogg Vorbis audio codec using following code snippet
			
			recorder_obj.setAudioEncoder(MediaRecorder.AudioEncoder.VORBIS);
			
			</phrase>
		</concept>
		
		<concept label="congrats">
			<phrase>You're ready to be a zoologist!</phrase>
		</concept>
		
		<concept label="dont_be_clever">
			<phrase>Aren't you clever?</phrase>
		</concept>
		
		<!-- ent tutor concepts. -->
		
		
		<!-- student concepts. -->
		
		<!-- these match against external (MessageAnnotator) annotations. -->
		<concept label="yes" type="annotation">
			<phrase>AFFIRMATIVE</phrase>
		</concept>
		
		<concept label="no" type="annotation">
			<phrase>NEGATIVE</phrase>
		</concept>
		
		<!-- these match against regular expressions. -->
		
		<concept label="audiorecord" type="regex">
			<phrase>audiorecord</phrase>
		</concept>
		
		
		<concept label="mediarecorder" type="regex">
			<phrase>mediarecorder</phrase>
		</concept>
		
		<concept label="mammal" type="regex">
			<phrase>mammal|cow|dog|cat|human|gerbil|whale|elephant</phrase>
			<phrase>fur|hair|milk|warm</phrase>
		</concept>
		
		<!-- end student concepts. -->
		
	</concepts>
	
	
	<script>
		<goal name="start" difficulty="1">
			
			<step>
				<!-- deliver a statement from the concept named "introduction"  -->
				<initiation>introduction</initiation>
			</step>
			
			<step>
				<!-- Every step begins with an initating concept or literal phrase -->
				<initiation>audio_encoding</initiation>
				
				<!-- These are the "response" options. 
					If the concept between the tags matches the student statement, 
				    the "say" concept/phrase will be delivered by the tutor.
				    "push" adds another goal to the dialogue's stack. 
					 Note that goals should NOT be recursively nested. -->
					
				<response push="elicitate" say="ok">yes</response>
				<response push="remediate" say="ok">no</response>
                
				<!-- unanticipated-response is special: it's anything that doesn't match one of the above. -->
				<response push="remediate" say="ok">unanticipated-response</response>
			</step>
			
			
			<step>
				<initiation>Ok, move on.</initiation>
			</step>
		</goal>
		
		<!-- Goals are referenced by their names. "difficulty" is meaningless for now. -->
		<goal name="remediate" difficulty="0">
			<step>
				<initiation>Maybe this will help:</initiation>
			</step>
			<step>
				<!-- deliver a statement from the concept named "facts"  -->
				<initiation>facts</initiation>
			</step>

			<step>
				<initiation>Which one you will like to choose?</initiation>
                <response say="amr_wb_p">amr_wb</response>
                <response say="amr_nb_p">amr_nb</response>
				<response say="default_p">default</response>
				<response say="aac_p">aac</response>
                <response say="aac_eld_p">aac_eld</response>
				<response say="he_aac_p">he_aac</response>
				<response say="vorbis_p">vorbis</response>
				<response say="unrecognized">unanticipated-response</response>
			</step>
		</goal>
		
	   <goal name="elicitate" difficulty="0">

			<step>
				<initiation>Which codec you will use?</initiation>
                <response say="amr_wb_p">amr_wb</response>
                <response say="amr_nb_p">amr_nb</response>
				<response say="default_p">default</response>
				<response say="unrecognized">unanticipated-response</response>
			</step>
		</goal>
		
	</script>

</scenario>
